{
  "taskId": "task-2026-10-10-003",
  "targetVolume": "C:",
  "growthFixture": {
    "kind": "SYNTHETIC",
    "injectorRef": "harness://growth-injector-07"
  },
  "protectedAssets": [
    {
      "path": "C:\\fixtures\\protected\\photos",
      "baselineSha256": "e3b0c44298fc1c149afbf4c8996fb92427ae41e4649b934ca495991b7852b855"
    }
  ],
  "cleanupPolicy": { "eligibleCategories": ["CACHE"] }
}
